amc_name,manager_name,designation,bio
A K Alternative Asset Managers Private Limited,Mr. Vikas Jain,Chief Investment Officer,"With over 24 years of experience in the Indian debt market, Mr. Vikas Jain has been a pivotal figure at A. K. Capital Group, where he has led credit evaluation, advisory, and business development for a wide spectrum of private sector companies, including mid-market enterprises. Over the last about 10 years, he has been part of the investment banking team at A K Capital Services Limited, managing the proprietary pool of over Rs. 400 crores, focused on dealing in fixed income securities"
Accelt asset management LLP,Mr Vaibhav Agarwal,Founder and Fund manager,"Vaibhav Agarwal is the Founder and Portfolio Manager at Accelt Asset Management LLP. He brings with him 15 years of investing experience.Vaibhav achieved financial independence at the age of 35.He has worked as Head of Research at Basant Maheshwari Wealth Advisers and also with CitiBank, ICICI Bank and Aditya Birla Group.He is a Chartered Accountant, CFA Charterholder from the CFA Institute (Virginia, USA), Company Secretary, and has a Master’s degree in Finance along with NISM certification. He is an alumnus of St. Xavier’s College, Kolkata. Besides his passion for equity investing, Vaibhav likes to play lawn tennis and read books."
Aarth AIF,Mr Adheesh Kabra,Co-Founder and Fund Manager,"Adheesh Kabra, a Chartered Accountant, Company Secretary, and Certified Financial Planner, brings over 15 years of expertise in capital markets. As Co-Founder and Fund Manager of Aarth AIF, he specializes in identifying high-potential investment opportunities, particularly in the SME sector, and designing agile investment strategies that deliver sustainable growth. Adheesh's strong institutional network and deep promoter relationships empower him to validate and execute investment ideas effectively, ensuring atractive returns for investors. His leadership and strategic insights have been instrumental in shaping Aarth AIF's commitment to transparency and high-growth opportunities. Previously, Adheesh founded Prabhat Investment Services and AS Finalysis Ventures LLP. He also served as Director & CFO of Prabhat Financial Services Ltd."
Aarth AIF,Mr Rishi Agarwal,Co-Founder and Fund Manager,"A Chartered Accountant, CFA Charter holder, and Certified Fund Manager, brings over a decade of expertise in shaping investment strategies for family offices and corporate treasuries. His experience spans designing and implementing investment policies and risk management frameworks, enabling institutions to navigate complex financial landscapes effectively. Rishi has led finance transformations for corporates with assets exceeding Rs.1,000 crore and has worked closely with CXOs of wealth management firms managing over $40 billion in AUM. Known for driving cost efficiencies of over Rs.500 crore and optimizing treasury operations, his strategic approach and deep financial insights enable him to make high-impact investment decisions at Aarth Growth Fund, ensuring sustainable returns and long-term value creation for investors."
Abans Investment Managers,Mr. Abhishek Bansal,Founder Chairman & Managing Director,"A post graduate in Business Administration from S K School of Business Management (2001-03). He carries along with him at 17 years of work experience in the financial industries. With his previous company Standard chartered he performed in various roles. He started as senior investment advisor at standard and went to be become a Associate director and cluster head for wealth advisory. He was also a product manager for Alternate products at standard chartered for almost two year. Post which he went to become a Director & Head - Premium Business (Handling PMS & Private Banking business for Standard Chartered Securities (India) Ltd). He currently leads the Wealth & Investment Management business at Abans group of companies. He also been a part of various companies like Aditya Birla group, Kotak Mahindra Bank and Citi group."
Abans Investment Managers,Mr. Bhavik Thakkar,CEO - ABans Wealth & Investment Managers,"A post graduate in Business Administration from S K School of Business Management (2001-03). He carries along with him at 17 years of work experience in the financial industries. With his previous company Standard chartered he performed in various roles. He started as senior investment advisor at standard and went to be become a Associate director and cluster head for wealth advisory. He was also a product manager for Alternate products at standard chartered for almost two year. Post which he went to become a Director & Head - Premium Business (Handling PMS & Private Banking business for Standard Chartered Securities (India) Ltd). He currently leads the Wealth & Investment Management business at Abans group of companies. He also been a part of various companies like Aditya Birla group, Kotak Mahindra Bank and Citi group."
Abans Investment Managers,Mr. Kaushik Dani,Portfolio Manager,"Kaushik has over 23 years of experience in Indian Capital Markets in the areas of Fund Management, Equity Research and Portfolio Management. He has worked with some of the large Portfolio Management Companies in India including Reliance Wealth, Karvy, KR Choksey and Sharekhan. In his previous role he was a leading Portfolio Manager responsible for managing various discretionary strategies. The Midcap PMS Strategy there had a good track record of outperforming the benchmark Index over long periods. He has also worked with Mutual funds like Birla Sunlife Mutual Fund and Peerless Mutual Fund. At Peerless MF, he was the key Equity Fund Manager and also headed Equities. He has done his MBA in Finance from Canadian School of Management and Graduation from Mumbai University."
Abans Investment Managers,Mr. Mayank Mundhra,Vice President - Risk Management,"Mayank conceptualized and set up the Enterprise Risk Management desk at Abans based on his experience of over 16 years at industry leading firms. Having played multiple roles in risk management, credit research, MIS and predictive modeling, Mayank believes that effective risk management is the most fundamental business enabler. An undergraduate degree holder in engineering, Mayank is also armed with a postgraduate degree in Finance from the Mumbai University."
360 ONE Asset Management,Mr. Anup Maheshwari,Chief Investment Officer,"Mehul Jani is President of Fund Management at 360 ONE Asset, earlier known as IIFL Asset Management. Prior to 360 ONE Asset, Mehul was associated with DSP Investment Managers Private Limited (formerly known as DSP BlackRock Investment Managers Private Limited), where he was a fund manager and analyst. He joined DSP BlackRock in October 2008 as an Analyst in the Equities team. Mehul has previously worked with Morgan Stanley Plc, London as an Associate working with structured product valuations and fund derivatives. He is a CFA Charterholder and has an MSc in Banking and International Finance."
360 ONE Asset Management,Mr Mehul Jani,Fund Manager,"Mehul Jani is President of Fund Management at 360 ONE Asset, earlier known as IIFL Asset Management. Prior to 360 ONE Asset, Mehul was associated with DSP Investment Managers Private Limited (formerly known as DSP BlackRock Investment Managers Private Limited), where he was a fund manager and analyst. He joined DSP BlackRock in October 2008 as an Analyst in the Equities team. Mehul has previously worked with Morgan Stanley Plc, London as an Associate working with structured product valuations and fund derivatives. He is a CFA Charterholder and has an MSc in Banking and International Finance."
360 ONE Asset Management,Mr Mitul Patel,Fund Manager,"Mitul Patel is the Senior EVP of Fund Management at 360 ONE Asset, earlier known as IIFL Asset Management. He brings 19 years of experience in Indian financial services, including the buy-side in fund management, equity research and portfolio management. During his first stint at 360 ONE Asset, he managed PMS funds and several listed AIFs. He was also Head of Research, responsible for generating investment ideas across sectors and market capitalizations. Prior to re-joining 360 ONE Asset, he headed the listed PMS & AlF business at HDFC Asset Management, where he managed more than USD 400 million in AUM. He was also part of the investment committee of their category II AlFs (Fund of Funds) on the private equity / VC side. Mitul was one of the founding members of Laburnum Capital, a Delhi-based investment firm where he spent seven years. Prior to Laburnum, Mitul was an investment banker with J. P. Morgan and Avendus Capital, where he executed M&A and PE transactions as an analyst. Mitul has an undergraduate degree in Business with a focus on Management Information Systems and Operations Management in the US."
360 ONE Asset Management,Mr Nishant Vass,Fund Manager,"Nishant Brings with him 15 years of Investment Experience. Prior to Joining 360 One In January 2022, he was associated with ICICI Securities Ltd in Institutional Equities team where he was leading the Automative sector research practice. Nishant has done MBA with an Engineering Background."
Accuracap,Dr. Naresh Chand Gupta,Inventor and CEO,"A Corporate Executive, Computer Scientist, and a prolific Researcher, Naresh is a Gold medalist from IIT-Kanpur and a Ph.D. from the University of Maryland. Before pursuing investing fulltime, Naresh was the founder and Managing Director of Adobe India from 1997 till March 2015. He conceived and grew Adobe's presence in India to 3500+ engineers over 18 years. Under his leadership, 40% of Adobe's core research and development was done at the Indian campus and several hundred global patents filed from campus. As part of Adobe's global executive team, he was running one of the three global businesses in Adobe's $8 Billion portfolios. Naresh is a prolific researcher and inventor. He is the author of several widely referred and seminal scientific papers in the area of Artificial Intelligence, Pattern Recognition, and Computer Vision. He holds seven Individual U.S. Patents."
2Point2 Capital,Mr. Amit Mantri,Co-Founder,"Savi Jain has 11 years of experience in the asset management industry, more than 6 years of which were in the private equity Industry. In his last role, he was an Associate Director at Tano Capital, a prominent Mumbai based private equity fund that manages more than USD 210 million worth of assets. He served as a Director on the Board of MSH Sarees that owns the popular ethnic wear brand 'Jashn'. Prior to Tano, he was with Frontline Ventures, another private equity fund. He has evaluated more than 500 investments in diverse industries in his 6 years in private equity. Apart from several unlisted investments, he has been involved in making marquee listed investments such as Astra Microwave, Shilpa Medicare, DCB Bank and Safari Industries. Prior to his private equity career, he worked in ICICI Prudential Life Insurance with their actuarial/investment team that managed more than INR 300 billion in equity and debt assets. Savi received a Bachelor’s degree in Industrial Engineering from IIT Kharagpur. He is also a CFA® charterholder."
2Point2 Capital,Mr. Savi Jain,Co-Founder,"Savi Jain has 11 years of experience in the asset management industry, more than 6 years of which were in the private equity Industry. In his last role, he was an Associate Director at Tano Capital, a prominent Mumbai based private equity fund that manages more than USD 210 million worth of assets. He served as a Director on the Board of MSH Sarees that owns the popular ethnic wear brand 'Jashn'. Prior to Tano, he was with Frontline Ventures, another private equity fund. He has evaluated more than 500 investments in diverse industries in his 6 years in private equity. Apart from several unlisted investments, he has been involved in making marquee listed investments such as Astra Microwave, Shilpa Medicare, DCB Bank and Safari Industries. Prior to his private equity career, he worked in ICICI Prudential Life Insurance with their actuarial/investment team that managed more than INR 300 billion in equity and debt assets. Savi received a Bachelor’s degree in Industrial Engineering from IIT Kharagpur. He is also a CFA® charterholder."
2Point2 Capital,Mr. Vishal Gupta,Principal– Investments,Over 19 years of experience in real estate investments &fund raising. Leads investments in commercial real estate strategy. Successfully raised over Rs.1500 crores at the firm. Chartered Accountant
Acepro Advisors Pvt Ltd,Mr Rajesh Kumar,Fund Manager & Principal Officer,"With over nine years of experience in Capital Markets, Investment Banking, Business Valuation, and Financial Modeling, he possesses strong analytical skills and a deep understanding of financial numbers and investment products. He has played a key role in developing business models and conducting valuations across diverse sectors. He brings proven expertise in managing critical projects and has extensive experience as a Research Analyst in PMS services. Before joining Acepro, he worked with reputed organizations such as Kotak Securities, Kredent Capital, and Majortrend Capital in various capacities."
Ace Lansdowne Investments Services LLP,Mr. Vikram Kotak,Fund Manager,"Mr. Vikram Kotak has than 29 years of outstanding investment experience across equities & debt. In his previous role as CIO – Equities for Deutsche Asset Management India, he led the team that provided equity investment advisory for more than US$ 1.2 billion in equity assets. Before that, he oversaw establishment and growth of equity and debt investment function at Birla Sun Life Insurance where he used to head investments of more than USD 4 billion."
35North Ventures Pvt Ltd,Mr. Ashwani Singh,Managing Partner,"Seasoned investor with 20+ years of investments and senior management experience in industry and global financial services. Ashwani is a Sloan Fellow from London Business School, MBA, B.Tech (Mechanical), and a Certified Investment Professional (CIP) UK."
35North Ventures Pvt Ltd,Mr. Milan Sharma,Managing Partner,"Seasoned advisor, mentor and investor, Milan is an alumnus of London Business School and has completed MS (Finance) specializing in structured products. He is a qualified Chartered Financial Analyst (ICFAI) and a Law Graduate."
A9 Finsight Pvt Ltd,Mr Abhishek Jaiswal,Fund Manager,"Abhishek brings over 8 years of expertise in Financial Markets, having formerly spearheaded operations at HedgeGen, a private investment fund focusing on Equity Investments and Index Derivatives Strategy. Holding an MBA from Liverpool Business School and through his proprietary Quant Model and Market Matrix Studies, he maintains a steadfast commitment to remaining abreast of industry advancements, consistently enriching his knowledge and infusing innovative strategies into investment decision-making at Finavenue."
ASK Long Short Fund Managers Pvt Ltd,Mr Piyush Shah,Chief Investment Officer,"Piyush joined ASK Group in September 2023 as CIO & Fund Manager, Hedge Fund Solutions to build and manage the Alternate Investment platform. His current role, is setting the investment style and strategy of the firm’s investments managing the various alternate offerings, including the flagship, India long-short strategy as well as complete oversight over the investment team and business management. His key responsibilities include sourcing, managing, and monitoring investment, establishing investment policies and collaborating with the fund management team to optimise investment performance."
ASK Long Short Fund Managers Pvt Ltd,Mr Vaibhav Sanghavi,Chief Executive Officer,"Vaibhav joined ASK Group in Aug 2023 in the capacity of Managing Director & CEO, Hedge Fund Solutions to build and manage the Alternate Investment platform. Vaibhav’s responsibilities include, managing the various alternate offerings, including the flagship, India long-short strategy as well as complete oversight over the investment team and business management."
Abakkus Asset Manager Private Limited,Mr. Aman Chowhan,"Fund Manager, PMS","Aman has over 17 years of Indian equity experience. Prior to joining Abakkus he was Portfolio manager for all local and offshore schemes for PMS division of Reliance Asset Management (now Nippon Life India Asset Management). Having worked at Singapore office of Reliance, Aman brings along a regional and global perspective in investing and has strong track record across – benchmark, absolute long and long-short strategies. Before joining Reliance in 2005 he was associated as research analyst with TAIB securities, Tata TD waterhouse and other brokerage firms. Aman holds an MBA degree from Mumbai University."
Abakkus Asset Manager Private Limited,Mr Hitesh Arora,Fund Manager,"Mr.Hitesh Arora ia a Fund Manager at Abaakkus Asset Management Private Limited, bringing nearly two decades of strong domestic and global market experience. He has worked with reputed institutions such as Unifi Capital, Deutche Bank, and J.P. Morgan, handling diverse rolls across equity research, fund management, structuring, and risk management in india and abroad. Hitesh holds an MBA from IIM Bangalore, an MS in Financial Engineering from Columbia University, a B. Tech (Hons) from IIT kharagpur, and is a CFA Chartholder."
Abakkus Asset Manager Private Limited,Mr. Sunil Singhania,"Fund Manager, PMS","Sunil Singhania, CFA, is the Founder of Abakkus Asset Management, LLP, an India-focused Asset Management Company established in 2018. Prior to this, in his role as Global Head – Equities at Reliance Capital Ltd., he oversaw equity assets and provided strategic inputs across Reliance Capital Group of companies including asset management, insurance, AIF and offshore assets. And as CIO – Equities, Singhania led Reliance Mutual Fund (now Nippon India Mutual Fund) equity schemes. Reliance Growth Fund (now Nippon India Growth Fund) grew over 100 times in less than 22 years under Singhania’s leadership. Furthermore, he led Reliance Asset Management (now Nippon Life India Asset Management)Ltd.’s international efforts and was instrumental in launching India funds in Japan, South Korea, and the UK, besides managing mandates from institutional investors based in the US, Singapore, and other countries. He is currently appointed on the IFRS Capital Market Advisory Committee. (2020-2023). He was the Promoter of The Association of NSE Members of India; a body of stock brokers. He served on the Global board of CFA Institute, USA (2013-2019) and as Chairman of the Investment Committee (2017-2019) of the CFA Institute, USA. He also sat on CFA Institute’s Standards of Practice Council for six years, and was the Founder of the Indian Association of Investment Professionals (now CFA Society India) and served as its President for eight years. He is a CA rankholder and a CFA charterholder and graduated in commerce from the Mumbai University."
ASK Investment Managers Ltd,Mr George Heber Joseph,CIO & CEO - Equity,"George brings over two decades of experience in equities and capital markets. At ASK, he leads investment strategy, performance, product innovation, and growth across PMS, AIFs, offshore funds, and the upcoming mutual fund platform. He joins ASK from Jio BlackRock AMC, where he was Chief Investment Officer and played a key role in setting up the India JV. Previously, he led investments and strategy at ICICI Prudential PMS and ITI Asset Management. He has spent over a decade at ICICI Prudential AMC where he was overall responsible for managing ~USD 2 billion in equity assets. A Chartered Accountant and Cost & Management Accountant, George is known for his stock-picking skills, long-term value approach, and track record of scaling investment platforms."
ASK Investment Managers Ltd,Mr. Kuldeep Gangwar,Vice President - Portfolio Manager,"Sandip has a work experience of over 20 years with 16+ years in equity markets. Sandip joined ASK from SBI Life Insurance where he has been an Equity Fund Manager & was Head of Investment Research, leading research across asset classes. Sandip has also worked on the Sell-side with UBS Securities and Kotak Institutional Equities. Before that Sandip was a business consultant at KPMG and also has banking experience with Citibank. Sandip is a Chartered Accountant, Company Secretary, and an MBA from IIM, Ahmedabad. Sandip joined ASK in July 2021."
ASK Investment Managers Ltd,Mr Sandip Bansal,Senior Portfolio Manager,"Sandip has a work experience of over 20 years with 16+ years in equity markets. Sandip joined ASK from SBI Life Insurance where he has been an Equity Fund Manager & was Head of Investment Research, leading research across asset classes. Sandip has also worked on the Sell-side with UBS Securities and Kotak Institutional Equities. Before that Sandip was a business consultant at KPMG and also has banking experience with Citibank. Sandip is a Chartered Accountant, Company Secretary, and an MBA from IIM, Ahmedabad. Sandip joined ASK in July 2021."
ASK Investment Managers Ltd,Mr Sumit Jain,Fund Manager - Deputy CIO,Sumit has around 19 years of experience in Indian equity markets. He was actively involved in the conceptualization of the Indian Entrepreneur strategy and currently manages the Indian Entrepreneur Portfolio with an AUM of over USD 2.5 billion. He also oversees other investment strategies at ASK. He has also been instrumental in building the proprietary valuation models at ASK. In the past Sumit has worked with ICICI Prudential Life Insurance and First Global Securities in the past. He is a Postgraduate in Management from Mumbai University. He joined ASK in October 2005.
Aequitas Investment Consultancy Pvt Ltd,Mr. Siddhartha Bhaiya,Managing Director and Fund Manager,"Meet Siddhartha Bhaiya, the dynamic force behind Aequitas Investments. As the Managing Director and CIO at Aequitas Investment Consulting Pvt. Ltd., he's reshaping the world of finance with his sharp insights and contrarian stock-picking approach. With over 25 years of experience in Equity research and fund management, Siddhartha has propelled Aequitas to deliver jaw-dropping 33% CAGR returns over more than 12 years. With a deep focus on valuations, his latest venture focuses on the East Asian Markets."
Agreya Capital Advisors LLP,Mr. Arjun Narsipur,Co-CIO and Fund Manager,"Arjun is a seasoned finance and markets professional with over 14 years of experience across equity, FX, global markets and treasury risk management. His area of focus is converting investment philosophies into testable, repetable processes and algorithms."
Agreya Capital Advisors LLP,Mr. Shailendra Agarwal,Co-CIO and Fund Manager,Shailendra has 17 years of experience in debt capital markets and structured finance. This expericne gives him a unique balance sheet perspective of businesses. He has a keen sense of valuig a business and marrying it with it's business prospects.
Aequitas Investments IFSC Pvt Ltd,Mr. Subham Agarwal,Principal Officer,SEBI Reg No : IFSC/AIF3/2023-24/0115
Aditya Birla Sun Life AMC,Mr. Akshat Pandya,Fund Manager,"Over 24+ years of real estate private equity, investment banking and construction finance experience in India. Led and executed investments in excess of > $470 million, has been a part of transactions > $3 billion. Has worked with AXIS Capital, ENAM, Lehman Brothers and HDFC Limited. Master’s degree in Management Studies (specializing in Finance) and a Bachelor’s degree in Commerce from the University of Mumbai."
Aditya Birla Sun Life AMC,Mr Amit Kansal,Fund Manager,"With over 22 years of professional experience, including approximately 14 years at Aditya Birla Capital, as well as roles at ICICI Bank, Ernst & Young, and other organizations, Mr. Amit Kansal has built a broad and deep expertise in finance and investment. He conceptualized and led the joint venture between Aditya Birla Capital and Värde Partners, a US-based credit fund. At Aditya Birla Finance, he headed the Project & Structured Finance vertical for the North and East regions, delivering project-linked lending, structured debt, and corporate finance solutions to large and mid-market corporates. His experience spans the full investment spectrum, from low-yield instruments to high-yield special situation transactions. He is an alumnus of Shri Ram College of Commerce and a rank-holding Chartered Accountant."
Aditya Birla Sun Life AMC,Mr Salvin Shah,Fund Manager,"Has 13+ years in Portfolio Management and Equity Research, Salvin has extensive experience in managing Indian Equities. His endeavour is to maximize returns for the investors while keeping an eye on portfolio risk. He has been successful at identifying themes and stocks at a very early stage which has resulted in multi-bagger returns for the investors. Prior to joining ABSLAMC, he worked with Sanctum Wealth Management as Co-fund Manager in their PMS business. Before Sanctum, Salvin was a part of equity research team at Edelweiss Securities and Athena Investment Management. He is a Member of Institute of Chartered Accountants of India (ICAI) and a commerce graduate from Mumbai University."
