amc_name,manager_name,designation,bio
Omniscience Capital Advisiors Private Limited,Mr Vikas Gupta,Founder,"Vikas founded OmniScience Capital to provide a scientific approach to Global and India listed-equity investments. Together with his team, he formulated the proprietary Scientific Investing Framework Scientific Investing Framework is the outcome of rebuilding investment management from first principles based on the combination of deep understanding of the 100+ years of investment research and the trial-by-fire over nearly two decades of investment experience across various global markets & market cycles. Deconstructing and reconstructing the above research and experience was the fundamental insight providing the foundations for Scientific Investing: In a risky asset class, such as equity, while, everyone is chasing alpha and getting risks, you could chase safety and get alpha.He filed for various patents, trademarks and copyrights to monetize intangible assets in various jurisdictions and initiated multiple academic partnerships with global institutions of research excellence such as LBS, CASS, ETFGI, Montclair State Univ., etc. He has a B.Tech from Indian Institute of Technology (IIT) Bombay and has earned his Masters and Doctorate from an Ivy League University—Columbia University, New York. He later served as a Research Scientist and Professor at University of California, Irvine, and IIT Kharagpur respectively. Vikas has been invited to write for global and India publications, such as, The Street (USA) and Seeking Alpha (USA), Moneycontrol, Mint, and Economic Times. He has been frequently quoted and interviewed in various publications on Indian and Global markets, such as Wall Street Journal, Bloomberg, Forbes, Gulf News, Economic Times, CNBC, ETNow, Channel News Asia and others. He has co-authored a book on Corporate Governance in the context of Sarbanes-Oxley."
PRPEdge Wealth Pvt Ltd,Mr Jyoti Prakash,Fund Manager,"Consistent performer, having over 35 years of experience. Last 12 years have been in the public domain in the role of Head of equities with Aegon Life Insurance. Earlier, worked with Amul Dairy, Foundation to Aid Industrial Recovery, Sahara India, Stewart & Mackertich and Guiness Portfolio Management Services. Graduate of PG program in Rural Management, flagship program of IRMA. Also, a CFA from ICFAI. The Hindu ranked one of the funds managed by him as the best performing multi-cap fund. An avid reader & author. Member of Advisory Board of IIM, Jammu."
PGIM India,Mr Aniruddha Naha,CIO,"Aniruddha Naha joined PGIM India in April 2018 and is currently CIO – Alternatives. He has over 22 years of experience in the equity and debt market. Aniruddha holds a Masters degree in Finance & Control, Delhi University. Aniruddha’s stock selection philosophy is based on the Growth at Reasonable Price (GARP) principle. He is a strong advocate of managing funds through a well-defined process led strategy with equal emphasis on strong risk management practices. This enables him to focus on consistency of performance over longer term and also protect downside in his pursuit of alpha generation. Risk-adjusted returns become the key outcome metric for such a research and process based approach"
PGIM India,Mr. Surjitt Singh Arora,"Fund Manager, PMS","Surjitt Singh Arora is Portfolio Manager – Portfolio Management Services at PGIM India Asset Management Private Limited. He is the Portfolio Manager for PGIM India Phoenix Portfolio and PGIM India Core Equity Portfolio. Surjitt holds a Bachelor’s degree in Management Studies from Sydenham College, Mumbai and a Master’s degree in Management Studies from Sydenham Institute of Management and Research (SIMSREE), Mumbai. Surjitt Singh Arora has more than 16 years of rich work experience in the Equity Markets including over 6 years in the asset management industry. In his last stint, Surjitt was Head - PMS and Principal Officer with Tata Asset Management. Prior to that he was with Tata Mutual Fund as Equity Research Analyst."
Pace Financial Investment Adviser Pvt Ltd,Mr Amit Goel,Fund Manager,"Amit Goel Co-founded Pace Group in 1995, and has led the group for over 25 years. Under his watch Pace group has grown from a fledgling NSE Broker in 1995 to a financial powerhouse that today has a pan-Indian presence, with customers in 35 countries. Pace has been nominated numerous times as one of the best Investment Advisors in India by ICRA & CNBC. He has appeared as an expert speaker on global markets on Indian Business Channels such as CNBC, ZEE Business, and ET Now. Over the last two and a half decades, he has managed/advised on proprietary and client investments and has traded across all financial asset classes and across a spectrum of Developed and Emerging Markets. He practices a unique investment philosophy amalgamating insights from the diverse streams of economics, finance, technical analysis, behavioral science, global politics, and the physical sciences to arrive at the most viable asset allocations and has had unprecedented success in consistently beating the markets over last two decades. Amit holds a Masters in Business Administration in Finance from the Faculty of Management Studies in Delhi."
Pelican Holdings Pvt Ltd,Mr. Deepak Radhakrishnan,Portfolio Manager,"Pelican Holdings Pvt Ltd., Trinity House, No.18, 2nd floor, 4th Street, Tirumurthi Nagar, Nungambakkam, Chennai – 600034. SEBI Reg No : INP000006891"
Piper Serica Advisors Pvt Ltd,Mr Abhay Agarwal,Founder and Fund Manager,"Abhay is the Founder and Fund Manager of Piper Serica Advisors, bringing over 30 years of investment experience. Piper Serica, a multi-asset manager, was founded in 2004 and is registered with SEBI. It serves as the PMS manager and advisor to the Piper Serica India Numero Uno Fund, a Foreign Portfolio Investor (FPI) based in Mauritius. Both entities focus on investing in stocks listed in India.In addition, Piper Serica manages the Piper Serica Angel Fund, a SEBI Category I Alternative Investment Fund (AIF), which invests in Indian tech startups. Its fintech portfolio includes prominent startups such as Alt Mobility, Kivi Fintech, Freed, Flashaid, OTPLess, Castler, Rupeeflo, and Swara Fincare.Before establishing Piper Serica, Abhay gained significant experience as a Director with the Private Equity group of JP Morgan in India, Hong Kong, and Singapore from 1997 to 2004. Prior to JP Morgan, he worked at Citibank India from 1993 to 1997, where he managed a direct investment program that resulted in several successful investments.Abhay holds an MBA from the Jamnalal Bajaj Institute of Management Studies, Mumbai (1993). He is also certified as an AIF Fund Manager, PMS Manager, Investment Advisor, and Research Analyst by NISM/SEBI.Abhay's extensive experience and deep expertise in investments make him a distinguished figure in the industry, driving the success and strategic direction of Piper Serica Advisors."
Phillip Capital India Pvt Ltd,Mr. Nishit Shah,Portfolio Manager,"Post-graduate with specialization in finance from Educatis School & ZCBI .More than 16 years of experience in Indian bond markets and banking .Worked with ICICI Bank in treasury and bond desks. Strong understanding of fixed income markets, origination and sourcing new debt papers and structuring debt term sheets.Finding top-notch issuers with appealing yields in the mid-market segment is our main goal. These issuers have a proven track record of profitability across market cycles & benefit from substantial shareholdings by major impact investors. They prioritize strong collection efficiency, cost management, a well-diversified client base, high NIMs, and robust digital infrastructure."
Phillip Capital India Pvt Ltd,Mr Vaibhav Singhal,Fund Manager,"Post-graduate with specialization in finance from Educatis School & ZCBI .More than 16 years of experience in Indian bond markets and banking .Worked with ICICI Bank in treasury and bond desks. Strong understanding of fixed income markets, origination and sourcing new debt papers and structuring debt term sheets.Finding top-notch issuers with appealing yields in the mid-market segment is our main goal. These issuers have a proven track record of profitability across market cycles & benefit from substantial shareholdings by major impact investors. They prioritize strong collection efficiency, cost management, a well-diversified client base, high NIMs, and robust digital infrastructure."
Pluswealth Capital Management LLP,Mr Rachit Singla,Fund Manager,"Rachit brings over a decade of experience across markets, quantitative research, and product strategy. He began his career in derivatives research and analysis. An MBA from IIFT Delhi, he blends strong analytical rigour with practical market insight. At PlusWealth, he focuses on building rule-based, risk-managed portfolios grounded in valuation discipline and regime analytics. His approach emphasises transparency, consistency, and long-term compounding for clients."
Prabhudas Lilladher,Mr. Siddharth Vora,"Head, Quant Investment Strategies Fund Manager, PL Asset Management Executive Director","Siddharth has spearheaded PL’s foray into the Quantitative Asset Management space with a vision to make investing adaptive, process-driven, and focused on sustainable alpha, while eliminating biases. He was early in recognising the potential of quant and the transformative role of leveraging technology and data analytics to revolutionise India's investment landscape. At PL, he has built and leads a multi-disciplinary team experts to introduce groundbreaking strategies."
Prescientcap Investment Advisors LLP,Mr Anubhav Mukherjee,Fund Manager,"Anubhav has more than a decade of investing experience in Indian public equities at India’s leading PE & VC firm SAIF Partners (Elevation Capital), which has more than 4Bn $ assets under management. At SAIF, his last role was a Principal in the investment team and he has extensive experience of the complete investing lifecycle across capital allocation, portfolio construction, position sizing, portfolio management and timing of exits. During his long investing career, he has built deep understanding of diverse sectors like pharma, IT services, consumer, engineering, infra, auto & ancillaries, cement, etc. He has a Post Graduate Diploma in Management from IIM Lucknow, where he was awarded the Director’s medal for academic excellence, and a B.E. in Computer Science (Merit Scholar) from NSIT, Delhi."
Prescientcap Investment Advisors LLP,Mr Sonal Minhas,Fund Manager,"Sonal’s decade long career spans across entrepreneurship, investment management and investment banking. In his last role, Sonal was leading a food-tech venture, which he exited/sold in 2018. He has led consumer, financial services and B2B investments at SAIF Partners (Elevation Capital) and AIF Capital. During his investing career that includes both public and private investing, he has actively led investments, represented his funds on the boards of portfolio companies, very closely worked with managements and led exits. He has a Post Graduate Diploma in Management from Indian School of Business, where he was a Dean’s scholar and was awarded the Torch Bearer award for winning the maximum number of competitions across B-schools in India, and has done his Civil Engineering from IIT Kanpur."
Prithvi Finmart Pvt Ltd,Mr Janak Kotecha,Fund Manager,"Mr. Janak is a Chartered Accountant by qualification and brings over a decade of valuable experience in the financial sector. His professional journey includes notable stints at prestigious institutions such as Morgan & Stanley and Alliance Fin Stock. Since joining the Prithvi Group at its inception in 2007, Mr. Janak has expanded his role to include Portfolio Management Services. As a key member, he leverages his extensive experience to guide and support his team, fostering excellence for both customers and the team."
Profusion Investment Advisors LLP,Mr Satyan Wadhwa,Founder and CIO,Satyan has over two decades of experience. Most recently he was CIO of Edelweiss Alpha fund a leading absolute return fund. Prior to joining Edelweiss Satyan worked with leading global hedge funds including Millennium Capital Management and Artha Capital in Singapore and Bluecrest Capital in London. Satyan hold an MBA from INSEAD and a degree in Mechanical Engineering and Industrial Management from Carnegie Mellon University.
Prosperity Wealth Management Pvt Ltd,Mr. Vasudev Gupta,"Fund Manager, PMS","14 Dr.Svks Thangaraj Road,Vinayagar Nagar,Madurai,Tamil Nadu,India-625020 SEBI Reg No : INP000007049"
Prudent Equity Pvt Ltd,Mr Diwakar Rana,Fund Manager,"Siddharth Oberoi is the Founder and Chief Investment Officer (CIO) of Prudent Equity. Siddharth has been a full-time investor since 1996. After gaining extensive experience, Siddharth realized the critical need of having a platform that can fulfil the need and guide people on where and how to invest. This, in turn, led him to establish Prudent Equity in 2012.With over 28 years of experience, Siddharth has a proven track record of leading, managing, and growing investor’s capital. He possesses extensive experience in the Indian capital markets and wealth management industry. Over the last 12 years advising on public equities, under his guidance, Prudent Equity has been able to deliver 41% CAGR returns for its clients. Siddharth has been able to beat the benchmark over each 3-year period since the last 28 years."
Prudent Equity Pvt Ltd,Mr Siddharth Oberoi,Founder & CIO,"Siddharth Oberoi is the Founder and Chief Investment Officer (CIO) of Prudent Equity. Siddharth has been a full-time investor since 1996. After gaining extensive experience, Siddharth realized the critical need of having a platform that can fulfil the need and guide people on where and how to invest. This, in turn, led him to establish Prudent Equity in 2012.With over 28 years of experience, Siddharth has a proven track record of leading, managing, and growing investor’s capital. He possesses extensive experience in the Indian capital markets and wealth management industry. Over the last 12 years advising on public equities, under his guidance, Prudent Equity has been able to deliver 41% CAGR returns for its clients. Siddharth has been able to beat the benchmark over each 3-year period since the last 28 years."
QRC Investment Advisors LLP,Mr Ayaz Motiwala,Fund Manager,"Ayaz has twenty five years of experience in equity research and investment management across various funds in India and Asia. At present, he advises Amala Emerging Asia Fund (AEAF)& which is focused on investing in high quality growth companies across Asia. Prior to advising the fund, Ayaz was part of the investment team at Samena Capital, a special situations fund. He also worked at Highbridge Capital Management, Hong Kong as part of the multi-strategy investment team where he managed a fund that invested in India and Asean. & In 2004 Ayaz joined New Vernon Capital in Mumbai which was amongst the first foreign alternate funds to enter India at that time. Prior to this engagement, he worked for five years at Birla Sun Life Asset Management Company Limited managing a few mutual funds and has & also worked for Motilal Oswal Securities as the lead consumer analyst. Ayaz started his professional investing career in 1996 as an analyst with ASK Raymond James. He holds an MBA in Finance from the Institute for Technology & Management."
QRC Investment Advisors LLP,Mr Saurabh Shroff,Fund Manager,"4, Floor-1, 9, Capri, Manav Mandir Road,Teen Batti, Malabar Hill,Mumbai,Maharashtra,India-400006 SEBI Reg No : INP000005892"
Purnartha Investment Advisers Pvt Ltd,Mr. Rahul Rathi,Fund Manager,"Rahul Rathi, has created a legacy of his own with 20+ years of experience in the field of investment and risk management. Having worked with global investment solutions and risk management for funds with an AUM of over $2 billion, he is the store house of ideas and guide to effective investment strategies. It is with his dexterity of growing wealth in the stock market, that Purnartha's investment philosophies have taken shape. Rahul holds Master's Degree in Business Administration from Carnegie Mellon University, USA and Polymer Engineering Degree from the Pune University. Rahul is the Fund manager and Principal Officer for Purnartha's Portfolio Management Services"
Purnartha Investment Advisers Pvt Ltd,Mr. Rohit Jain,"Fund Manager, PMS","Fund Manager Profile: Rohit is a Chartered Accountant and holds a Post-graduate diploma in Business Management. He has worked with CRISIL (an S&P Global Company) and Systematix Shares among others and carries over 13 years of experience in Equity Research for Institutional investors. Over the years, he has built extensive knowledge in financial modeling and valuations with sector expertise across major industries. Rohit also keeps himself updated on the latest developments on taxation, auditing, and compliance, which only adds to his existing wealth management and market know-how."
Qode Advisors LLP,Mr Gaurav Didwania,Fund Manager,"Gaurav Didwania is a finance expert with 15+ years of experience in investment management and advisory. Known for delivering exceptional returns and strategic insights, he holds a Bachelor of Management Studies (BMS) from NM College, Mumbai."
Qode Advisors LLP,Mr Rishabh Nahar,Fund Manager,"Rishabh Nahar is a professional with 8+ years in equity and quant research, leveraging advanced models and data analytics for market insights. He specializes in building proprietary algorithms to optimize asset classes. A finance graduate and self-taught coder, he excels in innovation and problem-solving."
Quest4Value Investment Managers LLP,Mr. Aniket Dharamshi,Managing Partner & Fund Manager,"10+ years of experience in investments at ValueQuest. Expertise in Defence, Energy Transition and Aerospace. Led the NCLT acquisition of Minosha India. Director at ValueQuest Investment Advisors Private Limited. Served on the Board of Minosha India & Entity Gaming."
Quest4Value Investment Managers LLP,Mr. Arvind Ananthanarayanan,Fund Manager,"15+ years experience in leading nuclear and materials research institutes with 11 patents and 40+ peer reviewed publications. Expertise in battery technology, renewable energy, nuclear engineering and materials science. Post-Ph. D. research experience in University of Lille (France), Muenster and Augsburg (Germany). Ph. D. in Physics by University of Mumbai and the Department of Atomic Energy (BARC) in 2010.Served on the Board of Waaree Energies Ltd."
RMS GROWTH LLP,Mr. Manish Lalwani,Fund Manager,"Finance professional with 10+ years of market experience & Founder, Sunday Investing"
RMS GROWTH LLP,Mr. Rohit Ramasubramanian,Fund Manager,Ex Management consultant & Serial Entrepreneur with a successful exit @ ZEFO
RMS GROWTH LLP,Mr. Soumil Agrawal,Fund Manager,Risk professional with 10+ years of risk assessment and lending FRM charter
Quest Investment Managers,Mr. Rakesh Vyas,Fund Manager,"Mr Rakesh Vyas has been active in capital markets for last 18 years of which more than 14 years were with HDFC Mutual fund where he was part of Fund management and research team. Over these years he has actively researched more than 150 companies across various sectors like Cement, Infrastructure, Utilities, Metals/Minerals, Chemicals, Real estate etc."
Reliance Wealth Management Ltd,Mr. Vikas Rajpal,"Fund Manager, PMS","4Th Floor, North Wing, Reliance Centre, Off Western Express Highway, Santacruz East, Mumbai - 400 055. SEBI Reg No : INP000002353"
Roha Asset Managers LLP,Mr. Daljeet Singh Kohli,Head – Equity / Principal Officer,"Daljeet Singh is an Investment Professional having overall experience of more than 25 years in the Indian Capital Markets. He was heading Research & Strategy at Vasuki India Fund, leading a team of talented analysts and strategists who cover the Indian equity market across various sectors and themes having outstanding skills in fundamental research and stock picking. He was Chief Investment Officer (CIO) of Stockaxis.com and also serving as Director & Principal Officer at Stock axis. He was actively managing multi-cap equity strategy PMS under the banner of Valentis Advisors Pvt Ltd. He was the Head of Research & Director at India Nivesh Securities Ltd. He has also led the Equity research teams at other eminent financial services houses such as India like Bonanza portfolio, Acumen Financial Services & Elite Stock Management."
Rational Equity Trust,Mr Krish Iyer,Fund Manager,"Krish Iyer is a global executive with over four decades of experience across six countries in retail, banking & finance and consumption sectors. He is currently the Managing Partner of Rational Equity Partners LLP & also an Independent Director on the Board of Proctor & Gamble Health & Hygiene Limited."
Rockstud Capital LLP,Mr. Abhishek Agarwal,Founder & Managing Partner,"Founder of Rockstud Capital (2017), a SEBI-registered multi-product AIF platform. Recognized as a Top 100 VC Investor with 17+ years across private and public markets. Frequent media voice on CNBC, ET Now, and Business Today; MSc Finance from Lancaster University."
Renaissance Investment Managers Pvt Ltd,Mr Pankaj Murarka,Fund Manager,"Pankaj Murarka is the Founder of Renaissance Investment Managers, an Alternate Investment Manager founded in 2016. Pankaj has over 25 years of experience in equity research & fund management with stellar track record of performance over his professional career. Prior to this, Pankaj was associated with Axis Mutual Fund for almost a decade as CIO, managing over $5bn in Indian equities. He was part of the team that set up Axis Mutual Fund in 2009 and over the years built it into one of the leading AMC in India on back of excellent investment performance. He was responsible for the performance of all the equity mutual funds of Axis AMC and during his stint as CIO, Axis AMC was recognized as the Best Equity Fund House of the year by Outlook Money for 2014. He was also awarded as Best Fund Manager - Runner up Award for Axis Midcap Fund by Outlook Money in 2014. The fund delivered a CAGR return of 24% (2011-2015) significantly outperforming the benchmark and was a top decile fund for 2012 & 2013. It ranked No.1 performing mutual fund in India across all funds in 2014 on 3 year basis. Axis Small Cap Fund - Best performing Small Cap Fund in 2014 with 84.3% returns. Some of the other funds managed by him included Axis Equity Fund, Axis Focused 25 Fund and SISF- India Opportunities Fund. He was also recognized by Outlook Money as a Leading Fund Manager with 5 years of track record of consistent performance in the year 2015. Pankaj has also worked with Merrill Lynch as India Portfolio Manager for Strategic Investment Group. He was the Portfolio Manager for the Long Only and the Long Short Fund. The fund did incredibly well including during the Global Financial Crisis in 2008. He was also part of the set up team at Rare Enterprises. During his stint with Rare Enterprises (Investment Office of Rakesh Jhunjhunwala), he has instrumental in making various investments for the firm which have done exceedingly well over the years and delivered strong returns. He also represented the firm’s interest on board of various companies advising them on capital allocation. Pankaj has also worked with Motilal Oswal and with UTI AMC in early years. During his career he has consistently delivered superior risk adjusted returns for over 25 years in public markets by following the Investment Philosophy of SQGARPTM (Sustainable Quality Growth at Reasonable Price).TM He has also been instrumental in executing various PIPE and Private Equity investments in his career. Pankaj is a rank holder Chartered Accountant from ICAI with all India merit. Pankaj is an avid marathoner and has completed 12 half marathons and 2 ultra-half marathons / endurathon"
Right Horizons,Mr Anil Rego,Fund Manager,"Born in New Delhi, Mukul Pal has spent the past 25 years developing quantitative investment strategies for active managers across the globe. He began his career at the Bombay Stock Exchange, supporting major Indian financial institutions, before expanding his advisory practice to Europe, where he worked with asset managers and the securities arms of global banks. Holding two master’s degrees—in finance and statistics—he also earned the Chartered Market Technician (CMT) and Chartered Alternative Investment Analyst (CAIA) designations. His significant contributions to financial technology have earned him recognition from MIT, and he has been invited to speak at prominent conferences worldwide, including the Princeton–Chicago Quant Conference. He has also played a pivotal role in bringing financial innovations to NASDAQ. Today, he leads a deep tech firm in Toronto, delivering advanced solutions that are designed to deliver alpha."
Right Horizons,Mr Mukul Pal,Fund Manager,"Born in New Delhi, Mukul Pal has spent the past 25 years developing quantitative investment strategies for active managers across the globe. He began his career at the Bombay Stock Exchange, supporting major Indian financial institutions, before expanding his advisory practice to Europe, where he worked with asset managers and the securities arms of global banks. Holding two master’s degrees—in finance and statistics—he also earned the Chartered Market Technician (CMT) and Chartered Alternative Investment Analyst (CAIA) designations. His significant contributions to financial technology have earned him recognition from MIT, and he has been invited to speak at prominent conferences worldwide, including the Princeton–Chicago Quant Conference. He has also played a pivotal role in bringing financial innovations to NASDAQ. Today, he leads a deep tech firm in Toronto, delivering advanced solutions that are designed to deliver alpha."
