amc_name,manager_name,designation,bio
Care Portfolio Managers Pvt Ltd,Mr. Arpit Shah,"Fund Manager, PMS","As the founder director and a qualified Chartered accountant, he brings over 18 years of rich capital market experience. A first-generation entrepreneur, he focuses on in depth research and business development, playing a key role in driving the company's strategic growth and establishing a strong presence in the financial sector. He has contributed articles / views to leading newspapers, newsletters and made presentations on equity markets as speaker at various platforms."
Care Portfolio Managers Pvt Ltd,Mr. Jayant Mamania,"Fund Manager, PMS","As a key member of the investment team, his exceptional stock-picking skills set Care PMS apart as a distinguished portfolio manager. With over 30+ years of experience, he leads the investment team effectively."
Carnelian Asset Management and Advisors Pvt Ltd,Mr Kunal Shah,"Principal officer , Fund Manager","1205/1206, One Lodha Place, Senapati Bapat Marg, Lower Parel (West), Mumbai – 400013 SEBI Reg No : INP000006387"
Carnelian Asset Management and Advisors Pvt Ltd,Mr Manoj Bahety,Co-Founder,"1205/1206, One Lodha Place, Senapati Bapat Marg, Lower Parel (West), Mumbai – 400013 SEBI Reg No : INP000006387"
Chanakya Capital Services Pvt Ltd,Mrs. Gautami Desai,"Fund Manager, PMS","Over 2 decades of experience in equity investments Joined CCSPL in 2008 and was part of the investment team advisers to Acacia Partners, one of the largest FIIs in India (Ruane Cunniff & Goldfarb) between 2010 to 2017 for the India equity portfolio over USD 2 billion Spent 10 years at the Unit Trust of India (UTI) gaining well-rounded experience in credit research and fund management In UTI, managed equity portfolio of INR 3,500 crores across five funds, three of which were rated amongst the best performing funds by Crisil, Lipper and Value Research Gautami is known to dive deep for researching companies. Ever heard of a fund manager walking on the ramp just to know branding / marketing of a large consumer company! Gautami is also a co-founder and director Micasa Education Pvt. Ltd. that runs K-12 schools under the brand name ‘Lumens School’. Its first school was established in 2011 at Vapi, which now has over 600 students and has become known for its quality of education. Gautami earned BE (Electronics) and Masters in Management Studies from Mumbai University."
Chanakya Capital Services Pvt Ltd,Mr. Rajesh Kumar Tiwari,"Fund Manager, PMS","Over 3 decades of experience in banking, equity and debt investments Established CCSPL in 2008. Acted as the advisor to Acacia Partners, one of the largest FIIs in India (Ruane Cunniff & Goldfarb) between 2010 to 2017 for the India equity portfolio over USD 2 billion Prior to starting CCPL, Mr. Tiwari was President (Credit) at UTI / Axis Bank. During his 7 years stint, he led expansion of the bank’s corporate credit portfolio from INR 1500 crores to INR 32,000 crores, simultaneously reducing NPA percentage from 6.50% to 0.30%. At UTI / Axis Bank, he led the turnaround of the corporate credit business of the bank to a quality and market leadership position. Between 1992 to 2001, Mr Tiwari spent 9 years at Unit Trust of India (UTI) where he pioneered and led professional equity research. He is also credited with turning around the India Fund to make it reach the top quartile among Indian offshore funds. He was a part of initial team from IDBI that established the SEBI in 1988. Mr. Tiwari hold PGDM (IIM-A) and Ph. D. (Finance) from University of North Texas Co – founder of Lumens and director of Micasa Education Pvt. Ltd. that runs K-12 schools under the brand name ‘Lumens School’. Its first school was established in 2011 at Vapi, which now has over 600 students and has become known for its quality of education."
Citrus Advisors Pvt Ltd,Mr Sanjay Sinha,Fund Manager,"Mr. Sanjay Sinha is a seasoned fund management professional with over two decades of experience. He served as CEO of L&T Mutual Fund until 2011, growing AUM fivefold in three years. He held senior roles at UTI AMC and SBI Funds Management, managing award-winning equity funds. An IIM Calcutta alumnus, he is also associated with Mumbai Angels and AMFI."
Centrum PMS,Mr. Abul Fateh,Fund Manager,"Abul brings over 19 Years of experience in the asset management industry, driving high quality equity research and portfolio management. He has held different positions with leading financial institutions such as Parag Parikh Financial Services, DBS Cholamandalam Mutual Fund, Baroda BNP Paribas Mutual Fund and most recently with True Beacon Investment Advisors where he was the head of fundamental Equities. During his tenure with Baroda BNP Paribas Mutual Fund he co-managed three portfolios of different styles, India Consumption fund, Business Cycle Fund and Large & Midcap Fund. Abul holds a Master’s Degree in Mathematics and a Post graduate Diploma in Securities Markets from Indian Institute of Capital Markets."
Ckredence Wealth Management Pvt Ltd,Mr Kartik Bhaskerray Mehta,Fund Manager,"Mr Kartik Bhaskerray Mehta is the Fund Manager of Portfolio Management Services. Armed with an MBA in Finance from the Indian Institute of Finance, Delhi, and with 20+ years of experience in Finance and Equity Management, he brings to the table an impressive knowledge of the market. Having worked with various esteemed institutions like IDFC Asset Management Ltd., Canara Robeco Asset Management Ltd., Sushil Financial Services Pvt Ltd, and Asset Alliance Securities Pvt Ltd, Mr. Kartik is the ideal person to manage a client portfolio and create comprehensive investment strategies."
Clearview Capital Advisors Private Limited,Mr. Ayush Vimal,Fund Manager,"Ayush Vimal has more than a decade of experience in the financial services domain across Investment Banking, Taxation and Assurance. In his last role, he was working in the Investment Banking team at Citi where he was advising top global Private Equity funds and large corporates on acquisitions, divestments and IPOs and was rated the top of his batch. He has been involved in advising on deals with a potential value of more than US$20bn across telecom, infrastructure and consumer sectors. Ayush has an MBA from IIM Ahmedabad and B.Com (Hons) from St. Xaviers' College, Kolkata. He is also a Chartered Accountant and Company Secretary. Besides investing, Ayush is passionate about reading, writing, swimming and is an ardent follower of Roger Federer."
Clearview Capital Advisors Private Limited,Mr. Vedant Bagry,Fund Manager,"Vedant Bagry has more than a decade of experience in the financial services domain across Investment Banking, Broking and Assurance. In his last role, he was working with J.P. Morgan in their Investment Banking division where he was advising top global Private Equity funds and large corporates on acquisitions, divestments and IPOs and was rated the top of his batch. He has been involved in deals totalling over ~US$12bn across financial services and infrastructure sectors. Vedant has an MBA from IIM Calcutta and B.Com (Hons) from St. Xaviers' College, Kolkata. He is also a CFA® Charterholder, Chartered Accountant and Company Secretary. Besides investing, Vedant is passionate about reading, travelling, cricket."
Clockvine Capital Advisors Pvt Ltd,Mr Jasdeep Walia,Fund Manager,"Jasdeep is the founder and fund manager of Clockvine Capital.Jasdeep has worked for almost 17 years (2004-2021) at Kotak Mahindra Bank in various businesses related to equity markets. He has had comprehensive experience on various facets of business: equity research, investment management and sales.Jasdeep has done Bachelors of Engineering (1998-2002) from Netaji Subhas University of Technology and MBA from IIM-Kolkata (2002-2004)"
Composite Investments Pvt Ltd,Mr. Vinod Jayaram,"Fund Manager, PMS","Vinod specializes in investing in listed Indian mid and small cap companies. He is always in the lookout for companies that are relentlessly taking small steps in the right direction that in turn builds on itself and gains momentum and produces more and more positive results, just like a flywheel. He was associated with one of the best performing small & mid cap fund (Novastar Funds) during 2010-2015 (family of a board member at Berkshire Hathaway invested in the fund). He has done his PGDM from IIM Lucknow and B.com (Hons) from Sri Satya Sai University. His interests include Crossfit, Vipassana, Running and Reading."
Compound Everyday Capital Management LLP,Mr Sumit Sarda,Fund Manager,"Sakar Bhawan, 2Nd Floor, Atm Side,21/4 Ratlam Kothi Main Road, Above Federal Bank,Indore,Indore,Madhya Pradesh,India-452001 SEBI Reg No : INP000006633"
Counter Cyclical Investments Pvt Ltd,Mr. Gunit Singh Narang,Fund Manager,MA Economics from Delhi School of Economics (DSE) NISM certified. Half decade experience in credit risk management & market research at American Express & Wells Fargo.
Cosmea Portfolio Mgnt Pvt Ltd (erstwhile Torus),Mr Ankit Doshi,Fund Manager,"Ankit Doshi - Seasoned professional with more than a decade of experience in finance and technology with key focus on quantitative research and factor-based investing. A specialist in alpha-driven strategies, with a deep understanding of big data analytics and algorithmic trading"
Cosmea Portfolio Mgnt Pvt Ltd (erstwhile Torus),Mr. Hemal Shah,Fund Manager,"Hemal Shah brings to the table extensive market experience that spans over 14 years. He currently holds the position of a Fund Manager at Torus Oro AMC, bringing his experience in wealth management to manage portfolios for HNI clients and drive investment strategies. Hemal started his journey in this sector as a DNT Executive in Sharekhan in 2009. From there he transitioned to Angel Broking where he was an equity advisor to NRI clients, offering tailored investment advice. His career rajectory continued to manage 250 clients in equity advisory and portfolio restructuring during his stint at ICICI Securities. Post that he spent nearly half a decade with Aditya Birla Capital, where he oversaw portfolios worth over 150 crores on Non-Discretionary PMS. As a Fund Manager with Torus Oro, Hemal manages portfolios worth over INR 100 Cr. Hemal Shah's vision revolves around an underlying approach to active management, aiming to capitalize on market volatility and steady information flow to the benefit of his clients. Having specialized in structured portfolio, tailored to individual needs, he focuses on niche markets and mid-cap segments that cannot be replicated easily. Hemal holds a Masters in Accounting & Finance from the University of Mumbai (2012) and a Business Diploma from the Welingkar Institute of Management (2014). He has a contrarian approach, where he consistently seeks opportunities that may otherwise be ignored, ensuring he delivers trust and value to his clients. He has delivered personalized investment solutions that have stood the test of time."
Craving Alpha Wealth Fund,Mr Mayank Mehra,Fund Manager,"Mayank Mehra is the Founder and Fund Manager of Craving Alpha Wealth Fund, a Category III AIF focused on high-quality franchises at inflection points, available at deep value. With over a decade of experience in equity research, quant investing, and portfolio construction, he combines fundamental insight with proprietary models to deliver alpha across market cycles.A CFA and FRM candidate and a Master in Business Administration, Mayank started his career on a proprietary trading desk before launching Craving Alpha as a SEBI-Registered Investment Advisor in 2018. His investing framework—MIST (Macro, Industry, Strategy, Trend)—guides a disciplined approach to identifying mis- priced opportunities while hedging risk through selective short positions.Craving Alpha Wealth Fund is designed to scale without style drift, maintaining a partially hedged posture to safeguard against macro shocks. Mayank’s philosophy centers on optimizing risk to unlock scalable alpha.He regularly shares insights via the Craving Alpha Substack and is known for his contrarian thinking, macro foresight, and focus on positioning equities as a scalable, liquid wealth-building asset class."
Concept Investwell Pvt Ltd,Mr Hemant Desai,Fund Manager,"Mr. Hemant Desai is the Promoter and Chairman of Concept Investwell Pvt. Ltd. Academically, he is a graduate in Economics and a post-graduate in Business Management with the specialization in Finance. These qualifications are combined well with rich experience of roughly 50 years in Banking, Management Consultancy, Real Estate and Investment Services (25 years in Capital Markets Services)."
Concept Investwell Pvt Ltd,Mr Siddharth Mandalaywala,Fund Manager,"10/A Union Heights ,Maharana Pratap Road, Rahul Raj Mall Lane,Dumas Road,Surat,Gujarat,India-395007 SEBI Reg No : INP000006323"
Credent Asset Management Services Pvt Ltd,Mr Naysar Shah,Fund Manager,"22+ years of experience in Equity Research and Fund Management. Managed funds at Birla Sun Life for 4 years with an AUM of ~ 2,500 Cr. He has tracked a large no. of companies across sectors and market caps."
DRChoksey FinServ Pvt Ltd,Ms. Vaishali Pitale,"Fund Manager, PMS",SEBI Reg No : INP000007906
DSP Asset Managers Private Limited,Mr Gaurav Pant,Fund Manager,"Gaurav joined DSP in March 2014 as part of the Investment Alternatives Business. After completing his PGDM from the Indian Institute of Management, Ahmedabad, Gaurav began his career at the London office of Goldman Sachs in the Financing Group of the Investment Banking Division. In 2007, he moved to the Goldman Sachs Principal Strategies division, where he focused on European equities. In 2011, Gaurav joined Dalton Capital and set up a long-short fund for Indian equities."
DSP Asset Managers Private Limited,Mr Natraj Sankaranarayan,Fund Manager,"Natraj joined the DSP Investment Team in November 2023 to build long-only focused equity strategies. He brings over 25 years of investment experience, including 12 years managing India-focused bottom-up strategies, 5 years managing Global Emerging Markets portfolios, 3 years managing GCC strategies, and 2 years managing an ESG fund. He holds a PGDBA (Finance) and a B.Com. degree."
DSP Asset Managers Private Limited,Mr Suryanarayanan Manian,Co-Fund Manager,"Surya joined DSP in July 2011 as part of the Product Management Group. He completed his PGDM from the Indian Institute of Management, Ahmedabad, in 2008 and began his career at the Private Wealth Management Desk at Anand Rathi. Surya moved to DSP’s Equity Team in January 2014 and went on to manage the DSP Technology.com Fund (July 2015 – July 2017) and the DSP A.C.E. Fund (December 2017 – July 2021). Since August 2022, he has been working with the AIF Team."
Dalal and Broacha Stock Brocking Pvt Ltd,Mr Milind Karmarkar,Director & Senior Fund Manager,"Dalal & Broacha's research department, comprising a team of six, was set up by this Chartered Accountant. He joined the firm over fifteen years ago after having spent a few years in corporate planning and financial management. He has an experience of more than 35 years in equities."
Dalal and Broacha Stock Brocking Pvt Ltd,Mr Nawaz Sarfaraz,Fund Manager,"An engineering and management graduate by qualification, Nawaz has been the Head of Research at IDBI MF before joining D&B in February 2019. He has an experience of more than 17 years in equities."
Dolat Capital Market Pvt Ltd,Mr. Purvag Shah,"Managing Director, CIO & Fund Manager","A Third-generation Business leader from the Dolat Group, Purvag inherits a legacy of over 60 years of pioneering expertise in crafting intricate Trading and Derivative Strategies. Renowned for their unique ideation and methodology, these strategies have been effectively employed in Fund Management at both the Dolat Group's Proprietary business and Dolat Capital’s Alternative Investment Strategies."
Driv Drisht LLP,Mr Ishan Daga,Fund Manager,"Surabhi, 2nd Floor, 8/1/2 Dr. U.N.Brahmachari Street, Kolkata 700017 SEBI Reg No : INP000008570"
Dynamic Equities Pvt Ltd,Mr. Shailesh Saraf,Fund Manager,Mr. Shailesh Saraf focuses on generating high alpha at substantially lower risk through his excellently devised strategies and stocks. His emphasis on long term quality and growth as foundational principles for equity investing has greatly benefited the investor community
East Green Advisors LLP,Mr Pratik Karmakar,Fund Manager,"Pratik Karmakar, MBA (FMS Delhi), B. Tech. CS, (NIT)"
East Green Advisors LLP,Mr Vinay Arya,Fund Manager,"Vinay Arya, MBA (FMS Delhi), All India rank-holder CA, CS, B.Com (H) (SRCC)"
Edelweiss Financial services limited,Mr. Gautam Berry,Fund Manager,"CFA Charter holder, MS in Finance from University of Illinois, Urbana-Champaign, and Bachelor of Engineering from University of Mumbai.Over a decade of experience across research, trading, operations, and spearheading processes for new fund launches .Worked with one of India’s First AIF Start up"
Edelweiss Global Wealth Management Ltd,Mr Pavan Garikapati,Fund Manager,.
Edelweiss Global Wealth Management Ltd,Mr Prolin Nandu,Principal Officer,"Prolin Nandu is an accomplished expert in institutional equities with 14 years of experience in the industry. For 9 of those years, he was an integral member of GMO, where he played a vital role in managing an emerging markets fund valued at approximately USD 2.5 billion, with specific oversight of India exposure amounting to around USD 500 million. His extensive career encompasses tracking multiple sectors and companies across different market capitalisations.Prolin possesses prestigious qualifications, holding both a CFA and an MBA, which enhanced his passion for investing. He advocates for the virtuous learning cycle that weaves together investment lessons with life experiences.A strong proponent of the Indian narrative, Prolin is inspired by the belief that, if navigated wisely, India can secure decades of prosperity.In his leisure time, Prolin finds comfort in fiction, immersing himself in engaging narratives and exploring new realms through literature. He dedicatedly follows football and F1, eagerly anticipating a mean reversion in Manchester United's fortunes and a turnaround in luck for Ferrari, especially with the possibility of Lewis Hamilton wearing the iconic red. Prolin also enjoys travelling, seeking nourishment for his spirit through journeys across natural landscapes. Above all, he is captivated by the intricate tapestries of individual stories and the remarkable journeys they encompass."
Electrum Portfolio Managers Pvt Ltd,Mr. Romil Jain,Fund Manager,"Romil has an experience of 12 years in Fund management and Equity research with leading organizations like Quantum Advisors, JM Financial PMS and Systematix PMS. At Quantum, he was part of the research team, Quantum manages money for offshore clients like foundations, pension funds and endowments. In his recent role he has worked at Systematix PMS covering diverse sectors as well as helping the CIO on portfolio management.Romil is a CFA (USA), Chartered Accountant and a Commerce Graduate from HR College, Mumbai."
Eklavya Capital Advisors LLP,Mr Abhishek Chauhan,Fund Manager,"Abhishek Chauhan is a veteran in Indian Equity market with over 17+ years of experience. He has extensive experience of evaluating long term business prospects of companies in India and APAC. He has experience in entrepreneurship, consulting and finance in India & Singapore. He is an alumnus of Tuck Business School at Dartmouth, IIM Ahmedabad and IIT Kanpur."
ElementOne Ventures LLP,Mr. Amit Sanan,Co-Founder & Managing Partner,"Amit is a seasoned banker with over 25 years in Indian and global banking. He held leadership roles at Standard Chartered Bank (MD & South Asia Head-Structured Trades & Financing Solutions) and Yes Bank (Group President - Mid Corporate Banking), with distinguished stints at American Express Bank (Corporate Banking) and Rabo India Finance (Corporate Finance). Currently based in New York and New Delhi, his domain expertise includes structured financing, credit assessment, managing large asset portfolios, and investment banking."
ElementOne Ventures LLP,Mr. Puneet Aggarwal,Co-Founder & Managing Partner,"An Investment Banking professional with over 20+ years of leadership experience in Structured Credit and Alternative Investments. Puneet co-founded India's first Online Bond Platform Provider (OBPP), a Fintech Platform launched in 2020 to democratize institutional grade fixed income products."
Emkay Investment Managers Ltd,Mr. Kashyap Javeri,"HOR , Fund Manager","Manish Sonthalia is a commerce graduate from St Xaviers Kolkata and an MBA from IISWBM. Manish is also the member of ICAI, ICWAI & ICSI. He has three decades of experience in the markets with forte in research, asset management and investment management. He is the Chief Investment Officer at Emkay Investment Managers Ltd."
Emkay Investment Managers Ltd,Mr. Manish Sonthalia,"Director , CIO","Manish Sonthalia is a commerce graduate from St Xaviers Kolkata and an MBA from IISWBM. Manish is also the member of ICAI, ICWAI & ICSI. He has three decades of experience in the markets with forte in research, asset management and investment management. He is the Chief Investment Officer at Emkay Investment Managers Ltd."
Emkay Investment Managers Ltd,Mr Sachin Shah,"Executive Director , Fund Manager","Paragon Centre,C-06,2nd Floor, Pandurang Budhkar Marg, Opp. Birla Centurion Worli India-400013. SEBI Reg No : INP000004458"
Enigma Investment Partners,Mr Viraj Mehta,Fund Manager,"Mr. Viraj Mehta has more than 16 years of experience in Investment & Research. He is the CIO and Partner at Enigma Investment Partners LLP and has completed his PGDBM in Finance from MDI, Gurgaon, and B.E. in Chemical Engineering from Nirma Institute of Technology (Gujarat University), respectively. He was the Managing Director of Equirus Portfolio Management Services, where he was responsible for setting up the PMS (AMC business) and the team from scratch, and was managing capital of ~ Rs. 11bn for clients. Equirus Long Horizon Fund was one off the best performing PMS schemes delivering ~25% CAGR returns for its clients over his tenure. Prior to Equirus, he was associated with Franklin Templeton as lead analyst for managing the small companies fund, which was awarded the best small-cap MF scheme by CRISIL & Business Standard. He has also worked with ValueQuest Capital LLP."
Equanimity Management Services LLP,"Mr. Rajesh Sehgal, CFA",Fund Manager,"A Wharton and XLRI alumnus, his specialty is finance, marketing and management. He is a seasoned investment professional having worked across asset classes at Templeton Emerging Markets Group and SBI Capital Markets."
Envision Capital Services Pvt Ltd,Mr. Nilesh Shah,"Fund Manager, PMS","Envision Capital Services Pvt Ltd 33,Maker Chambers VI, Jamnalal Bajaj Marg, Nariman Point, Mumbai 400 021 SEBI Reg No :"
Estee Advisors Pvt Ltd,Mr Sandeep Tyagi,"Chairman, Managing Director","Sandeep Tyagi is the Chairman and Managing Director of Estee Advisors. He is a B. Tech from IIT Delhi and an MBA from Columbia Business School. He is responsible for setting the firm’s direction, sustaining a winning culture and developing profitable investment strategies. Prior to Estee, Mr. Tyagi was CEO of Inductis, a consulting and analytics firm that he founded in 2000. Mr. Tyagi is a board member of the IIT Delhi Excellence Foundation and a Charter Member of TiE. He is also a board member of the Young Presidents Organization (YPO), Delhi Chapter. He has received numerous awards including 40 under 40 for New Jersey and the Distinguished Alumni Service Award from IIT Delhi."
Estee Advisors Pvt Ltd,MR. Vivek Sharma,Investment Head,"Vivek Has been in trading and investing field for 20 years now. He is a graduate from IIT Kharagpur.He has traded international markets for over 10 years with Futures First, where he setup their Energy Trading Desk. He has trained 100’s of successful traders during his time with Futures First.For the last 8 years, Vivek has been focusing on Quant Trading and Investments. He is passionate about helping and educating investors manage their money well."
Equirus Wealth Pvt Ltd,Mr Ashutosh Tiwari,Head of AMC and CIO - Public Markets,"Mr. Ashutosh Tiwari is the head of AMC and Chief Investment Officer (CIO) - Public Markets. He is the fund manager for Equirus Long Horizon Fund and Equirus Flexi Cap Fund. He has over 20 years of professional experience, including 16.5 years in the securities market. He served as Managing Director & Head of Institutional Equities at Equirus Securities Private Limited, where he also held leadership roles as Head of Equities for 4 years and Head of Research for 6 years. Earlier in his career, he worked as a Research Analyst covering the Auto and Metals sectors and was ranked No. 1 for Earnings Estimates in the Automobile sector by the Thomson StarMine Analyst Awards in 2015. Known for his contrarian investment approach, He began his securities market journey with KR Choksey Shares and Securities after working as a Mining Engineer at Hindustan Zinc (Vedanta Resources Plc).He is MBA qualified in Finance and has completed his graduation (B.Tech) in Mining Engineering from the Indian Institute of Technology (BHU), Varanasi."
