amc_name,manager_name,designation,bio
Karma Capital Advisors Pvt Ltd,Mr Vinay Jain,Fund Manager,"Mr. Vinay Jain joined Karma Capital in May 2013. Prior to joining Karma Capital, he worked with SS&C GlobeOp Financial Services Ltd in Valuations division for nine months where he was responsible for carrying out independent valuation analysis for non-OTC, illiquid and hard to value (HTV) securities for Hedge Fund and Pension Fund clients. As part of his Post Graduation Internship, he had worked with Karma Capital as a Management Trainee in May – June 2011. He has completed his MBA in Finance from University of Mumbai and has also done his B.E. in Electronics from University of Mumbai"
Klay Securities Private Limited,Mr Ravi Malani,Fund Manager,"A seasoned Equity professional with over 30 years of rich experience in Indian Equities in Capital Markets and Wealth Management as Head of Equities at esteemed institutions like Credit Suisse Wealth, Barclays Wealth , BNP Baribas Paribas Wealth , Kotak Mahindra Wealth. He has managed money across various formats – Mutual Fund, Discretionary PMS, Non-Dis PMS , Institutional Equity Sales"
Kotak Mahindra Asset Management Company Ltd,Mr Brijesh Ved,Principal Officer & Head- PMS,"27 Bkc, C-27, G Block Bandra Kurla Complex,Bandra (E), Mumbai 400051,Mumbai,Maharashtra,India-400051 SEBI Reg No : INP000000837"
Kotak Alternate Asset Managers Limited,Mr. Dr Ashish Ranja,Fund Manager,"13+ years of experience in life science. Previously, Ashish led consumer insights & NPP for Sanofi, part of commercial and scientific diligence team for Cipla. Worked as management consultant at consulting firm IQVIA. Ashish holds a Ph.D. in medicine from Humboldt University, Berlin, Germany and Masters in Business Management from Copenhagen Business School, Denmark. He was also a fellow at the IMB (A*STAR), Singapore"
Ladderup Wealth Management Pvt Ltd,Mr Raghvendra Nath,Fund Manager,"Mr. Raghvendra Nath has more than three decades of capital markets and investment management experience. His ability to analyse trends and evaluate businesses has supported him to lead a few esteemed organisations in the industry.He has worked with Birla Sun Life Mutual Fund, one of the leading Mutual Fund companies in India. In his tenure he successfully created Asset Allocation strategies for various MF Schemes. He tracked macro-economic factors in India & globally to identify major trends & analyze the impact on fund performance as well as the overall business. His acumen in creating differentiated strategies to address investor needs contributed to the success of the firms he has been associated with.Prior to this he was the business head for Aditya Birla Money. He is a CFA, MBA and an Engineer by qualification and provides thought leadership to the business. He has an impeccable reputation in the Indian Markets and is a frequent face in the Indian Business media."
Ksema Wealth Pvt Ltd,Mr Sankar Kailasam,CIO,"Sankar is the Chief Investment Officer for KSEMA and heads the Fund Management team. He has a Master’s Degree in Mathematics and Finance. He has nearly 3 decades of experience in capital markets in India, Saudi Arabia and Oman. He has managed a Saudi family office multi asset class portfolio worth USD 50 million in Global Markets. Prior to Joining KSEMA, he was the Head of Asset Management in a leading Gulf based AMC, Gulf Baader Capital Markets SAOC, managing investments worth USD 250 million for sovereign funds, family offices and corporate in the Gulf Region. The First Mazoon Fund managed by him was awarded the Lipper award by Reuters in 2010 for its five-year performance. He has successfully completed the Investment Advisor Certificate Examination conducted by NISM, India."
Lead Invest,Mr. Hanuman Tripathi,Fund Manager,"Masters in Management from JBIMS and a PG Diploma in Marketing Management from Bhavan’s College. 40+ years of experience in various roles. Founded and managed Infrasoft Technologies, a globally reputed banking technology company, for two decades."
Lead Invest,Mr. Sushanto Mitra,Founder & CEO,"First external CEO at SINE, leading a key innovation and entrepreneurship hub. Former Director at Hyderabad Angels, with deep expertise in angel investing. 20+ years of experience in financial services and the entrepreneurial ecosystem."
MRG Investment Partners Pvt Ltd,Mr Manu Rishi Guptha,Founder & CEO,Mr. Manu Rishi Guptha have 25+ years of investment experience. A full-time MBA Graduate from the Warwick Business School. Stock Market and Hospitality are his passion and comments on these subjects voraciously.
Lakewater Advisors Pvt Ltd,Mr Pankaj Singhania,Co-founder & Fund Manager,"604, Martin Business Park,Block Bp 3, Salt Lake, Sector V, Kolkata,Kolkata,West Bengal,India-700091 SEBI Reg No : INP000006767"
Magadh Capital Advisors LLP,Mr. Vipul Prasad,"Fund Manager, PMS","Vipul Prasad is the Founder and CEO of Magadh Capital Advisors LLP. He has been running the PMS, as the Fund Manager of Magadh Capital since August, 2021. Vipul has worked in senior roles in investment management, equity research, planning, marketing and maintenance in fields of investment banking and manufacturing in his career spanning over 26 years. Vipul was Fund Manager for Magadh Capital’s long-only equity fund (Alternative Investment Fund, Category III) for 3 years and had earlier worked for 12 years as an institutional equity research analyst with some of the largest and most reputed investments banks in the world (10 years with Morgan Stanley and before that, 1 year each with Motilal Oswal Securities and ABN AMRO), advising institutional investors- largely foreign institutional investors but also some of the largest Indian mutual funds and insurance companies- regarding stock investments in Indian markets. He was consistently ranked amongst top equity analysts in client ratings – both internally as well as externally {Institutional Investor (2012, 2014, 2015), Asiamoney (2008)}, and in other rankings like India Today (2008) and Bloomberg (2007). He holds a Master’s in Business Administration from Indian Institute of Management, Kolkata (PGDM in Finance and Strategy) and a Bachelor’s degree (B. Tech in Mechanical Engineering) from Indian Institute of Technology, BHU, Varanasi."
Mavenark Asset Managers Private Limited,Mr. Phanisekhar Ponangi,Fund Manager,"He is one of the co-founders of Mavenark and leads the investment team. He is a seasoned professional with a strong background in finance. He holds the Chartered Financial Analyst (CFA) Charter from the CFA Institute, USA and Chartered Alternative Investment Analyst (CAIA) Charter from CAIAA, USA. He has diverse and extensive work experience in the financial services sector, spanning approximately 20 years. In his two-decade career, he has primarily focused on financial analysis and investment management. Prior to co-founding Mavenark, he was Head of Investments (Fixed Income) at Klay Capital where he led the fixed income investments team in India. Prior to Klay, he was Business Head & CIO - Fixed Income PMS at Karvy Capital Limited where he built and scaled the fixed income portfolio management services (PMS) business ground up. He managed a peak Fixed Income PMS AUM upwards of INR 800 crores at Karvy Capital. Prior to Karvy Capital, he was an Equity Portfolio Manager with Karvy Stock Broking and Angel One (previously Angel Stock Broking). At Angel One, he practiced long-only equity investing and focused on asset allocation and security selection. He also set up the IT research practice and initiated benchmark coverage on stocks"
Mangal Keshav Financial Services LLP,Mr Paresh N Bhagat,Fund Manager,"Paresh N. Bhagat, Group Managing Director of Mangal Keshav, is a third-generation entrepreneur and the firm’s promoter since 1979. Over the decades, he has navigated every major market cycle from speculative bubbles to global crises demonstrating resilience, foresight, and disciplined risk management. Under his leadership, Mangal Keshav has evolved into a respected, growth focused franchise that protects and compounds wealth across generations."
Marathon Trends Advisory Pvt Ltd,Mr. Atul Suri,CEO – Portfolio Manager,"701A, Ramee Emeralds, Linking Road , Street 29, Santacruz West, Mumbai-400054. SEBI Reg No : INP000005722"
Marcellus Investment Managers Pvt Ltd,Mr. Ashvin Shetty,Fund Manager,Ashvin has more than 10 years of experience in equity research. He led the coverage on automobile sector at Ambit Capital from 2010 to 2017. He was ranked in Starmine Analyst Awards 2013 and 2016 for his stock picking abilities during this stint. He thereafter worked as a senior analyst for Ambit’s Mid and Small cap PMS funds till November 2018.
Marcellus Investment Managers Pvt Ltd,Mr Omkar Sawant,Fund Manager,"Flat No. 602, Tower 1 Odyssey ,Hiranandani Gardens, Powai,Mumbai,Maharashtra,India-400076 SEBI Reg No : INP000006183"
Marcellus Investment Managers Pvt Ltd,Mr. Rakshit Ranjan,Fund Manager,"Flat No. 602, Tower 1 Odyssey ,Hiranandani Gardens, Powai,Mumbai,Maharashtra,India-400076 SEBI Reg No : INP000006183"
Marcellus Investment Managers Pvt Ltd,Mr. Saurabh Mukherjea,Chief Investment Officer,"Flat No. 602, Tower 1 Odyssey ,Hiranandani Gardens, Powai,Mumbai,Maharashtra,India-400076 SEBI Reg No : INP000006183"
Marcellus Investment Managers Pvt Ltd,Mr. Tej Shah,Fund Manager,"Flat No. 602, Tower 1 Odyssey ,Hiranandani Gardens, Powai,Mumbai,Maharashtra,India-400076 SEBI Reg No : INP000006183"
Maximal Capital,Mr Sarvesh Gupta,Fund Manager,Mr. Sarvesh has been investing in equities for more than 15 years with 12 years of experience of being a full-time professional investor across the listed and unlisted space.
Mansi Share and Stock Broking Pvt ltd,Mr Hemant Shah,Fund Manager & Principal Officer,"Mr. Hemant Shah is the Principal officer and Fund Manager of Seven Islands. He is a strong believer in the philosophy – “Knowledge Protects, Courage Pays”. He is responsible for drawing out the investment strategy of the PMS. In over 30 years of his experience in the financial markets, he has worked with various established investment managers in setting up numerous research desks."
Maxiom Asset Management Pvt Ltd,Mr Ram Kalyan Kumar Medury,Fund Manager,"Ram Kalyan Kumar Medury - 25yrs Industry Experience, MBA, IIM Bangalore, BS Comp Sc."
Meenakshi Alternates Advisors LLP,Mr. Amit Upadhya,Fund Manage,"Mr. Amit Upadhyay, CIO of Meenakshi Alternates Advisors LLP. He is seasoned fund manager having 20+ years of experience across the fund lifecycle. He has managed Domestic and Offshore pools of capital across Equity, Mezzanine and Credit strategies. Having worked with prominent institution such as Axis Alternates and Piramal Capital. He was one of the founding team member at Axis Alternates Real Estate Fund, where he managed 2 credit funds having an AUM of Rs. 585 crores and delivered a return of ~19% gross IRR by deploying the funds across 11 deals. He was a part of senior management team at Piramal capital, where he was managing an AUM of Rs.5,000 crores+ and delivered a return of ~24% gross IRR by deploying funds across 21 deals. He is a qualified Chartered Accountant and holds an MBA from SDA Bocconi."
Mirae Asset Sharekhan Limited,Mr. Gaurav Dua,Fund Manager,"Gaurav Dua holds a bachelor’s degree in engineering and a post-graduate degree in finance from Mumbai University in 1997. His vast work experience spans over two decades across in many leading research and broking companies, in equity research and other capital market functions.At Sharekhan, he was head of research for almost 10 years. Currently, he is managing Sharekhan’s flagship PMS strategy, Prime Picks Portfolio – an innovative, all-weather portfolio, which is designed to outperform in all market conditions. He is supported by a strong team of 10-15 equity research analysts having average work experience of close to 8-10 years each."
Microsec Wealth Management Ltd,Mr. Naveen Vyas,Fund Manager - PMS,"Mr. Naveen Vyas is the Executive Director and Fund manager of Microsec Wealth. He has done his MBA Finance from Visvesvaraya Technological University (V.T.U) at Dr. Ambedkar College, Bangalore. He has over 15 years of Experience in capital markets with core focus on fundamental analysis, investment advisory and fund management activities. He has worked as VP Research for Microsec Capital Limited for more than 8 years and has been Ranked No.1 Analyst in Bloomberg BARR in the consumption space companies and has also been nominated for ZEE Analyst Award in FMCG category in 2013 while working for Microsec. Mr Naveen Vyas has been managing the PMS fund of Microsec Wealth Management since inception. He had also worked with LN Bangur Group, Kolkata wherein he was also been involved in managing the Prop-desk Equity Funds of the group. During his tenure of around 4 years, he has gained good experience of fund management activities wherein the Prop-desk Equity Fund’s return has outperformed the Free Float NIFTY Midcap 100 and NIFTY Free Float Small Cap 100 Index’s return."
Mastergrowth 369 Asset Managers Private Limited,Mr Ashutosh Kejriwal,Fund Manager,"Ashutosh Kejriwal is Chartered Accountant and B.com Graduate with 9 years of post-qualification experience in financial management and advisory. He was working as senior manager in one for the Big 4 consulting firm in the Assurance department where he had obtained the exposure of understanding each head of financial statements and also fundamentals of the Companies. He has extensive expertise in equity markets, with over 5 years of active investment experience and proven track record in analyzing financial statements, market trends, and investment opportunities. He has strong skills in risk assessment and strategic financial planning and he is committed to delivering value through informed investment strategies and sound financial practices. Further, he has cleared the certification required of NISM Series-XIX-C: Alternative Investment Fund Managers Certification Examination and has various other NISM certifications."
Mili Capital Management Pvt Ltd,Mr Harsh Nahar,Fund Manager,"International Experience : Worked in six countries across three continents, gaining a global perspective on business operations and markets.Professional Background : Held positions at leading Big Four firms, including PwC and KPMG, as well as global investment banks such as ICICI Bank and Bear Stearns & Co. Entrepreneurial Venture : Founder of a commodity trading and manufacturing operations focused on the East African market. Academic Credentials : Chartered Accountant (All India Rank - 2), MBA with distinction from the University of Michigan, and successfully completed all three levels of the CFA program."
Merisis Advisors Private Limited,Mr Akshay Badjate,Fund Manager,"Akshay Badjate brings with him 18 years + of rich experience in the field of Indian Capital Markets with a focus on public markets investing. Akshay has previously worked in leadership roles with a focus on product & investment research at early stage fintech companies. He has also worked with a host of reputed global investment banks such as JP MorganChase, Lehman Brothers / Nomura and Kotak Institutional Equities. During his stint at Alphaniti (Now TORUS-Alphaniti) between 2019-2023, Akshay identified and built several multi-bagger investment themes which consistently figured in the top 10 in the Smallcase universe performance rankings. Akshay is a Chartered Accountant by qualification and is extremely passionate about equities. While being highly data driven, Akshay adopts a long-term orientation towards both business and market cycles. His favorite book is ""Capital Returns"" which has deeply influenced his investment thought process."
Merisis Advisors Private Limited,Mr. Sumir Verma,Fund Manager,"25+ years in Investment Banking, Corporate Finance & Risk Management. Drives Fund Raise and M&A Strategy at Merisis Advisors. Tech Banker with deep domain expertise across domains (Enterprise Tech, Fintech, Consumer, Transportation Mobility Cleantech, etc). $1bn total transaction value in advisory closed across sectors. 65+ startups worked with, 18 M&A deals, 9 cross-border transactions. Aditya Birla Group, Scandent Group, EXIM Bank. MBA (XLRI-94), CA (1994 Batch)."
Moat Financial Services Pvt Ltd,Mr Biju John,Fund Manager,"Mr. Biju has over 20 years of experience in the financial markets, with expertise in equity research, portfolio management, and investment advisory services. At Moat Financial Services Pvt Ltd, he leads the design and execution of investment strategies focused on delivering sustainable, risk-adjusted returns. Known for his disciplined and structured approach, he combines rigorous research with robust risk management to help clients achieve their long-term investment goals."
Molecule Ventures LLP,Mr Nirav Parikh,Fund Manager,"Mr.Nirav Parikh has a rich investing experience of 16 years in Small and Mid size companies. He has in past worked with Ghalla Bhansali, Reliance equities, Alchemy Capital covering various sectors. He holds an MBA from NMIMS, Mumbai and is a Graduate in Commerce from Mumbai University. He is also CFA Charter holder (US) and FRM."
Monarch Networth Capital,Mr Abhisar Jain,Fund Manager,"Laxmi Tower, B Wing, 4th Floor, G Block, Bandra Kurla Complex, Bandra East, Mumbai 400051 SEBI Reg No : IN/AIF3/20-21/0787"
Morphosis Venture Advisors LLP,Mr. Narayanan Muralidharan,Fund Manager,"11 years in early-stage investments and working with India/Global tech scale-ups. Experience:: 59% IRR, 11.1x from portfolio of 21 start ups, Flipkart, EY-Parthenon. : IIT Roorkee, Indian School of Business"
N V Associates LLP,Mr Nitin Menon,Co-Founder,"Nitin Menon is a Chartered Accountant by qualification. In a career spanning over 22+years, Nitin has worked across diverse job functions and business divisions covering the Media & Entertainment sector, Investment Research and in the field of International taxation across various locations namely United States, Bangalore and Mumbai Over the last 15 years he has been a specialist knowledge banker in the Media & Entertainment Banking Group at YES BANK with longstanding experience in Deal origination, Sectoral Expertise & Financial Research & Analysis"
N V Associates LLP,Mr Vivek Menon,Co-Founder,"WeWork, Enam Sambhav, C - 20, G Block Rd, BKC, Bandra East, Mumbai, 400051 SEBI Reg No : IN/AIF2/21-22/0891"
Moneybee Securities Pvt Ltd,Mr Dhiren Shah,Founder,"The founder, Dhiren Shah, started as a sub-broker in the Equity Market. After fourteen years of successful operations in all areas of the Capital Market, Moneybee Securities Private Limited buzzed out. Moneybee is an emerging Investment Advisory company managing assets for its corporate and private clients worldwide."
NAFA Asset Managers Pvt Ltd,Mr Balaji Vaidyanath,CEO & CIO,"302, 3rd Floor, Naman Centre, Plot No. C - 31, G Block, Bandra Kurla Complex, Bandra (E), Mumbai 400 051 SEBI Reg No : INP000006989"
Money Grow Asset Pvt Ltd,Mr Manish Gupta,Principal Officer,"Manish has over 23 years of experience in Indian equity markets. He was part of the senior leadership team at CLSA’s Institutional Equities business in Mumbai and New York. During his 17-years at CLSA, he has advised leading FIIs, insurance companies, mutual funds, private equity funds and sovereign wealth funds on their Indian equity investments. He was involved in numerous IPOs, QIPs, equity placements, block trades during his tenure. He holds a 5-year Integrated M. Tech. from IIT Delhi (1999), MBA from IIM Ahmedabad (2001) and CFA charter holder from CFA Institute, USA."
Money Grow Asset Pvt Ltd,Mr. Viraj Mahadevia,Fund Manager & Partner,"Viraj has over 20 years of experience in finance,with 10 years in Private Equity in India as part of Actis (AUM of over US$ 7.5 Bn across various funds), one of the largest emerging market PE funds. He has over 5 years experience in previous assignments including M&A and capital raising for Healthcare and Consumer sectors at Goldman Sachs and Citigroup based out of their London offices. He holds an MBA in Finance and Leadership Change Management from the Indian School of Business, Hyderabad (2004) and a BSc in Electrical Engineering from the University of Michigan Ann Arbor (2000)."
NAV Capital Ltd,Mr. Vineet Arora,Fund Manager,"Mr. Vineet Arora, Managing Director and Chief Investment Officer at NAV Capital, is a seasoned private banker with extensive experience in managing global family office portfolios and multi-jurisdiction wealth operations. With over two decades of leadership across premier financial institutions, he brings deep expertise in investment advisory, portfolio construction, and high-net-worth client management."
NMR Capital Advisors LLP,Mr Nishith Minesh Shah,Portfolio Manager,"Mr. Nishith Shah brings over a decade of experience in equity markets, with a strong track record across investment research, portfolio management, and fund strategy. Previously, he served as Co-Fund Manager at Aequitas Investment Consultancy Pvt. Ltd., where he co-managed a Category III AIF with an AUM of Rs.1,500 crore, focused on long-only, long-term equity investments. During his more than 5 years tenure at Aequitas, he gained deep expertise in building concentrated, research-backed portfolios. Before Aequitas, he managed his family’s investment portfolio, gaining hands-on experience across both investing and trading strategies. He also had an early stint with Multi-Act Equity Consultancy Pvt. Ltd., where he further strengthened his understanding of equity research and portfolio construction.Qualifications: Chartered Accountant (CA) Chartered Financial Analyst (CFA), Level III cleared"
Motilal Oswal Asset Management Company Ltd,Mr. Abhishek Anand,Fund Manager,"Abhishek has over 20 years of experience in equities with more than 10 years of Fund Management experience. He has worked with organizations like CMIE, SBI Capital Markets Limited, Dun & Bradstreet. In his last stint with Centrum he worked as Portfolio Manager and generated strong performance. He is certified treasury manager and completed his Masters in Management Studies from Mumbai University."
Motilal Oswal Asset Management Company Ltd,Mr. Bijon Pani,Fund Manager,"Dr Bijon Pani, Ph.D. has over 12 years’ experience in quantitative investment management both globally and in India. He manages the quant strategies in AIF and PMS and also heads the quant research. He has previously worked at NJ AMC, IDFC AMC, Barclays Capital and Eden Financial. He was also a visiting faculty at XLRI Jamshedpur. Bijon has a Ph.D in Finance with specialization in factor investing from EDHEC, France. He also has a MS in Finance from London Business School and MSc in Comupter Science from Oxford University"
Motilal Oswal Asset Management Company Ltd,Mr Dhaval Mehta,Fund Manager,"Dhaval Mehta brings 14+ years of experience in equity research and portfolio management Prior to joining MOAMC, Dhaval was working with Aditya Birla Sunlife AMC as portfolio Manager, where he used to manage over ~3700 Crs AUM and has been delivered stellar performance across the investment cycles Prior to Aditya Birla Sunlife AMC, he has worked with ASk investment Managers, Emkay Global Financial Services, Ventura Securities and Infosys."
Motilal Oswal Asset Management Company Ltd,Mr. Vaibhav Agrawal,CIO - Alternates & Fund Manager,"Vaibhav Agrawal is currently managing ~10,000 crs AUM at Motilal Oswal Asset Management across alternate products. He has also managed a proprietary PMS and has over a decade of experience in stock picking and generating index-beating returns. He has worked as a ratings analyst at CRISIL and investment analyst at Motilal Oswal Asset Management. He holds a Bachelors in Computer Science from the University of Pennsylvania and an MBA from London Business School."
Nandan Advisors LLP,Mr. Deepak Maheshwari,Fund Manager,"Over 30 Years of diverse expertise, during which he has not only helped various large corporates with project finance, but also successfully led deal sourcing, screening, risk assessment and risk ring-fencing, as well as negotiation around critical terms during various MSME funding mandates."
Nandan Advisors LLP,"Mr, Rajat Kumar",Fund Manager,"Over 27 years of diverse experience in finance, strategy and operations, both as a CA as well as an operator. Significant aid in judging projections and operating feasibility, as well as assessing business strengths and weaknesses."
Nandan Advisors LLP,Mr. Sidharth Rath,Fund Manager,"Over 30 years of dynamic leadership in the financial sector. Built multiple businesses including setting up a full fledged universal bank in India, and with core experience in credit appraisal and project finance."
Negen Capital Services Pvt Ltd,Mr Jigar Dinesh Shah,Fund Manager,"Mr. Jigar Dinesh Shah has 16+ years’ experience with Negen Capital Services Private Limited in Capital Markets Investing, Research in Equities, Business Development, Risk Management, Risk Profiling of Clients & Client Communications. Qualifications - Graduate in commerce (B.Com.) from Mumbai University ,PGDBA in Finance from Welingkar Institute of Management Development, NISM Certified Investment Adviser Level I and Level II."
Negen Capital Services Pvt Ltd,Mr Neil Madan Bahal,Founder & Fund Manager,"Negen Capital Services Private Limited, Trade Point Building, 2nd Floor Above Passport Office Utopia City, P. B. Marg, Lower Parel (West) Mumbai 400013 SEBI Reg No : INP000005414"
